<?xml version="1.0" encoding="UTF-8"?>
<BaseDatosHR xmlns:xsi="http://www.w3.org/2001/XMLSchema-instance"
             xsi:noNamespaceSchemaLocation="BaseDatosHR.xsd">

    <REGIONS>
        <REGION>
            <REGION_ID>1</REGION_ID>
            <REGION_NAME>Europe</REGION_NAME>
        </REGION>
        <REGION>
            <REGION_ID>2</REGION_ID>
            <REGION_NAME>Americas</REGION_NAME>
        </REGION>
        <REGION>
            <REGION_ID>3</REGION_ID>
            <REGION_NAME>Asia</REGION_NAME>
        </REGION>
        <REGION>
            <REGION_ID>4</REGION_ID>
            <REGION_NAME>Middle East and Africa</REGION_NAME>
        </REGION>
    </REGIONS>

    <COUNTRIES>
        <COUNTRY>
            <COUNTRY_ID>US</COUNTRY_ID>
            <COUNTRY_NAME>United States of America</COUNTRY_NAME>
            <REGION_ID>2</REGION_ID>
        </COUNTRY>
        <COUNTRY>
            <COUNTRY_ID>CA</COUNTRY_ID>
            <COUNTRY_NAME>Canada</COUNTRY_NAME>
            <REGION_ID>2</REGION_ID>
        </COUNTRY>
        <COUNTRY>
            <COUNTRY_ID>UK</COUNTRY_ID>
            <COUNTRY_NAME>United Kingdom</COUNTRY_NAME>
            <REGION_ID>1</REGION_ID>
        </COUNTRY>
        <COUNTRY>
            <COUNTRY_ID>IT</COUNTRY_ID>
            <COUNTRY_NAME>Italy</COUNTRY_NAME>
            <REGION_ID>1</REGION_ID>
        </COUNTRY>
        <COUNTRY>
            <COUNTRY_ID>JP</COUNTRY_ID>
            <COUNTRY_NAME>Japan</COUNTRY_NAME>
            <REGION_ID>3</REGION_ID>
        </COUNTRY>
    </COUNTRIES>

    <LOCATIONS>
        <LOCATION>
            <LOCATION_ID>1700</LOCATION_ID>
            <STREET_ADDRESS>2004 Charade Rd</STREET_ADDRESS>
            <POSTAL_CODE>98199</POSTAL_CODE>
            <CITY>Seattle</CITY>
            <STATE_PROVINCE>Washington</STATE_PROVINCE>
            <COUNTRY_ID>US</COUNTRY_ID>
        </LOCATION>
        <LOCATION>
            <LOCATION_ID>1800</LOCATION_ID>
            <STREET_ADDRESS>147 Spadina Ave</STREET_ADDRESS>
            <POSTAL_CODE>M5V 2L7</POSTAL_CODE>
            <CITY>Toronto</CITY>
            <STATE_PROVINCE>Ontario</STATE_PROVINCE>
            <COUNTRY_ID>CA</COUNTRY_ID>
        </LOCATION>
        <LOCATION>
            <LOCATION_ID>2400</LOCATION_ID>
            <STREET_ADDRESS>8204 Arthur St</STREET_ADDRESS>
            <POSTAL_CODE></POSTAL_CODE>
            <CITY>London</CITY>
            <STATE_PROVINCE></STATE_PROVINCE>
            <COUNTRY_ID>UK</COUNTRY_ID>
        </LOCATION>
        <LOCATION>
            <LOCATION_ID>1000</LOCATION_ID>
            <STREET_ADDRESS>1297 Via Cola di Rie</STREET_ADDRESS>
            <POSTAL_CODE>00989</POSTAL_CODE>
            <CITY>Roma</CITY>
            <STATE_PROVINCE></STATE_PROVINCE>
            <COUNTRY_ID>IT</COUNTRY_ID>
        </LOCATION>
        <LOCATION>
            <LOCATION_ID>1200</LOCATION_ID>
            <STREET_ADDRESS>2017 Shinjuku-ku</STREET_ADDRESS>
            <POSTAL_CODE>1689</POSTAL_CODE>
            <CITY>Tokyo</CITY>
            <STATE_PROVINCE>Tokyo Prefecture</STATE_PROVINCE>
            <COUNTRY_ID>JP</COUNTRY_ID>
        </LOCATION>
    </LOCATIONS>

    <DEPARTMENTS>
        <DEPARTMENT>
            <DEPARTMENT_ID>10</DEPARTMENT_ID>
            <DEPARTMENT_NAME>Administration</DEPARTMENT_NAME>
            <MANAGER_ID>200</MANAGER_ID>
            <LOCATION_ID>1700</LOCATION_ID>
        </DEPARTMENT>
        <DEPARTMENT>
            <DEPARTMENT_ID>20</DEPARTMENT_ID>
            <DEPARTMENT_NAME>Marketing</DEPARTMENT_NAME>
            <MANAGER_ID>201</MANAGER_ID>
            <LOCATION_ID>1800</LOCATION_ID>
        </DEPARTMENT>
        <DEPARTMENT>
            <DEPARTMENT_ID>30</DEPARTMENT_ID>
            <DEPARTMENT_NAME>Purchasing</DEPARTMENT_NAME>
            <MANAGER_ID>114</MANAGER_ID>
            <LOCATION_ID>1700</LOCATION_ID>
        </DEPARTMENT>
        <DEPARTMENT>
            <DEPARTMENT_ID>40</DEPARTMENT_ID>
            <DEPARTMENT_NAME>Human Resources</DEPARTMENT_NAME>
            <MANAGER_ID>203</MANAGER_ID>
            <LOCATION_ID>2400</LOCATION_ID>
        </DEPARTMENT>
        <DEPARTMENT>
            <DEPARTMENT_ID>60</DEPARTMENT_ID>
            <DEPARTMENT_NAME>IT</DEPARTMENT_NAME>
            <MANAGER_ID>103</MANAGER_ID>
            <LOCATION_ID>1400</LOCATION_ID>
        </DEPARTMENT>
        <DEPARTMENT>
            <DEPARTMENT_ID>90</DEPARTMENT_ID>
            <DEPARTMENT_NAME>Executive</DEPARTMENT_NAME>
            <MANAGER_ID>100</MANAGER_ID>
            <LOCATION_ID>1700</LOCATION_ID>
        </DEPARTMENT>
    </DEPARTMENTS>

    <JOBS>
        <JOB>
            <JOB_ID>AD_PRES</JOB_ID>
            <JOB_TITLE>President</JOB_TITLE>
            <MIN_SALARY>20080</MIN_SALARY>
            <MAX_SALARY>40000</MAX_SALARY>
        </JOB>
        <JOB>
            <JOB_ID>AD_VP</JOB_ID>
            <JOB_TITLE>Administration Vice President</JOB_TITLE>
            <MIN_SALARY>15000</MIN_SALARY>
            <MAX_SALARY>30000</MAX_SALARY>
        </JOB>
        <JOB>
            <JOB_ID>AD_ASST</JOB_ID>
            <JOB_TITLE>Administration Assistant</JOB_TITLE>
            <MIN_SALARY>3000</MIN_SALARY>
            <MAX_SALARY>6000</MAX_SALARY>
        </JOB>
        <JOB>
            <JOB_ID>IT_PROG</JOB_ID>
            <JOB_TITLE>Programmer</JOB_TITLE>
            <MIN_SALARY>4000</MIN_SALARY>
            <MAX_SALARY>10000</MAX_SALARY>
        </JOB>
        <JOB>
            <JOB_ID>MK_MAN</JOB_ID>
            <JOB_TITLE>Marketing Manager</JOB_TITLE>
            <MIN_SALARY>9000</MIN_SALARY>
            <MAX_SALARY>15000</MAX_SALARY>
        </JOB>
        <JOB>
            <JOB_ID>MK_REP</JOB_ID>
            <JOB_TITLE>Marketing Representative</JOB_TITLE>
            <MIN_SALARY>4000</MIN_SALARY>
            <MAX_SALARY>9000</MAX_SALARY>
        </JOB>
    </JOBS>

    <EMPLOYEES>
        <EMPLOYEE>
            <EMPLOYEE_ID>100</EMPLOYEE_ID>
            <FIRST_NAME>Steven</FIRST_NAME>
            <LAST_NAME>King</LAST_NAME>
            <EMAIL>SKING</EMAIL>
            <PHONE_NUMBER>515.123.4567</PHONE_NUMBER>
            <HIRE_DATE>17/06/03</HIRE_DATE>
            <JOB_ID>AD_PRES</JOB_ID>
            <SALARY>24000</SALARY>
            <DEPARTMENT_ID>90</DEPARTMENT_ID>
        </EMPLOYEE>
        <EMPLOYEE>
            <EMPLOYEE_ID>101</EMPLOYEE_ID>
            <FIRST_NAME>Neena</FIRST_NAME>
            <LAST_NAME>Kochhar</LAST_NAME>
            <EMAIL>NKOCHHAR</EMAIL>
            <PHONE_NUMBER>515.123.4568</PHONE_NUMBER>
            <HIRE_DATE>21/09/05</HIRE_DATE>
            <JOB_ID>AD_VP</JOB_ID>
            <SALARY>17000</SALARY>
            <MANAGER_ID>100</MANAGER_ID>
            <DEPARTMENT_ID>90</DEPARTMENT_ID>
        </EMPLOYEE>
        <EMPLOYEE>
            <EMPLOYEE_ID>102</EMPLOYEE_ID>
            <FIRST_NAME>Lex</FIRST_NAME>
            <LAST_NAME>De Haan</LAST_NAME>
            <EMAIL>LDEHAAN</EMAIL>
            <PHONE_NUMBER>515.123.4569</PHONE_NUMBER>
            <HIRE_DATE>13/01/01</HIRE_DATE>
            <JOB_ID>AD_VP</JOB_ID>
            <SALARY>17000</SALARY>
            <MANAGER_ID>100</MANAGER_ID>
            <DEPARTMENT_ID>90</DEPARTMENT_ID>
        </EMPLOYEE>
        <EMPLOYEE>
            <EMPLOYEE_ID>103</EMPLOYEE_ID>
            <FIRST_NAME>Alexander</FIRST_NAME>
            <LAST_NAME>Hunold</LAST_NAME>
            <EMAIL>AHUNOLD</EMAIL>
            <PHONE_NUMBER>590.423.4567</PHONE_NUMBER>
            <HIRE_DATE>03/01/06</HIRE_DATE>
            <JOB_ID>IT_PROG</JOB_ID>
            <SALARY>9000</SALARY>
            <MANAGER_ID>102</MANAGER_ID>
            <DEPARTMENT_ID>60</DEPARTMENT_ID>
        </EMPLOYEE>
        <EMPLOYEE>
            <EMPLOYEE_ID>104</EMPLOYEE_ID>
            <FIRST_NAME>Bruce</FIRST_NAME>
            <LAST_NAME>Ernst</LAST_NAME>
            <EMAIL>BERNST</EMAIL>
            <PHONE_NUMBER>590.423.4568</PHONE_NUMBER>
            <HIRE_DATE>21/05/07</HIRE_DATE>
            <JOB_ID>IT_PROG</JOB_ID>
            <SALARY>6000</SALARY>
            <MANAGER_ID>103</MANAGER_ID>
            <DEPARTMENT_ID>60</DEPARTMENT_ID>
        </EMPLOYEE>
        <EMPLOYEE>
            <EMPLOYEE_ID>200</EMPLOYEE_ID>
            <FIRST_NAME>Jennifer</FIRST_NAME>
            <LAST_NAME>Whalen</LAST_NAME>
            <EMAIL>JWHALEN</EMAIL>
            <PHONE_NUMBER>515.123.4444</PHONE_NUMBER>
            <HIRE_DATE>17/09/87</HIRE_DATE>
            <JOB_ID>AD_ASST</JOB_ID>
            <SALARY>4400</SALARY>
            <MANAGER_ID>101</MANAGER_ID>
            <DEPARTMENT_ID>10</DEPARTMENT_ID>
        </EMPLOYEE>
        <EMPLOYEE>
            <EMPLOYEE_ID>201</EMPLOYEE_ID>
            <FIRST_NAME>Michael</FIRST_NAME>
            <LAST_NAME>Hartstein</LAST_NAME>
            <EMAIL>MHARTSTE</EMAIL>
            <PHONE_NUMBER>515.123.5555</PHONE_NUMBER>
            <HIRE_DATE>17/02/96</HIRE_DATE>
            <JOB_ID>MK_MAN</JOB_ID>
            <SALARY>13000</SALARY>
            <MANAGER_ID>100</MANAGER_ID>
            <DEPARTMENT_ID>20</DEPARTMENT_ID>
        </EMPLOYEE>
        <EMPLOYEE>
            <EMPLOYEE_ID>202</EMPLOYEE_ID>
            <FIRST_NAME>Pat</FIRST_NAME>
            <LAST_NAME>Fay</LAST_NAME>
            <EMAIL>PFAY</EMAIL>
            <PHONE_NUMBER>603.123.6666</PHONE_NUMBER>
            <HIRE_DATE>17/08/97</HIRE_DATE>
            <JOB_ID>MK_REP</JOB_ID>
            <SALARY>6000</SALARY>
            <MANAGER_ID>201</MANAGER_ID>
            <DEPARTMENT_ID>20</DEPARTMENT_ID>
        </EMPLOYEE>
    </EMPLOYEES>

    <JOB_HISTORY>
        <HISTORY>
            <EMPLOYEE_ID>102</EMPLOYEE_ID>
            <START_DATE>13/01/01</START_DATE>
            <END_DATE>24/07/06</END_DATE>
            <JOB_ID>IT_PROG</JOB_ID>
            <DEPARTMENT_ID>60</DEPARTMENT_ID>
        </HISTORY>
        <HISTORY>
            <EMPLOYEE_ID>101</EMPLOYEE_ID>
            <START_DATE>21/09/97</START_DATE>
            <END_DATE>27/10/01</END_DATE>
            <JOB_ID>AC_ACCOUNT</JOB_ID>